{
  "schemaVersion": 2,
  "themeId": "silicon-valley-causal",
  "axes": {
    "capital": {
      "negativePole": "Capital is scarce, patient, revenue-constrained, or unavailable to speculative startups.",
      "positivePole": "Capital is abundant, risk-seeking, and willing to fund rapid growth before profitability.",
      "eventDeltaRange": [
        -5,
        5
      ]
    },
    "founder_power": {
      "negativePole": "Employers, funders, boards, or public institutions retain operational control.",
      "positivePole": "Founders retain equity, decision rights, negotiating leverage, and public authority.",
      "eventDeltaRange": [
        -5,
        5
      ]
    },
    "openness": {
      "negativePole": "Research, standards, ownership, and distribution are classified, proprietary, or centrally controlled.",
      "positivePole": "Knowledge, protocols, markets, and production are open, interoperable, or permissionless.",
      "eventDeltaRange": [
        -5,
        5
      ]
    },
    "scale": {
      "negativePole": "Activity remains local, small, specialized, or limited to a narrow market.",
      "positivePole": "Organizations, platforms, capital, and cultural practices operate at mass or global scale.",
      "eventDeltaRange": [
        -5,
        5
      ]
    },
    "institutionalization": {
      "negativePole": "Activity depends on isolated individuals, informal networks, or fragile temporary support.",
      "positivePole": "Durable universities, firms, funds, laboratories, standards, and professional practices carry it forward.",
      "eventDeltaRange": [
        -5,
        5
      ]
    },
    "valley_concentration": {
      "negativePole": "Talent, firms, and capital are distributed among other regions or remote networks.",
      "positivePole": "Talent, firms, and capital are densely concentrated around Stanford and the Bay Area.",
      "eventDeltaRange": [
        -5,
        5
      ]
    }
  },
  "facts": {
    "electronics.amplification_available": {
      "type": "boolean",
      "default": false,
      "description": "Practical vacuum-tube signal amplification is available."
    },
    "stanford.entrepreneurship_model": {
      "type": "boolean",
      "default": false,
      "description": "Stanford actively steers engineers toward company formation."
    },
    "stanford.terman_location": {
      "type": "enum",
      "values": [
        "unknown",
        "stanford",
        "east_coast"
      ],
      "default": "unknown",
      "description": "Terman’s postwar institutional location."
    },
    "stanford.research_model": {
      "type": "enum",
      "values": [
        "unknown",
        "civilian",
        "classified",
        "mixed",
        "off_campus_defense"
      ],
      "default": "unknown",
      "description": "The organizational relationship between academic electronics and classified defense work."
    },
    "stanford.industrial_park": {
      "type": "boolean",
      "default": false,
      "description": "Stanford leases a dedicated industrial park to technology firms."
    },
    "hp.status": {
      "type": "enum",
      "values": [
        "none",
        "independent",
        "acquired"
      ],
      "default": "none",
      "description": "Whether HP exists independently or its early technology is absorbed by an incumbent."
    },
    "cluster.location": {
      "type": "enum",
      "values": [
        "unknown",
        "bay_area",
        "east_coast",
        "distributed"
      ],
      "default": "unknown",
      "description": "The primary geographic organization of the electronics and startup cluster."
    },
    "semiconductor.shockley_location": {
      "type": "enum",
      "values": [
        "unknown",
        "valley",
        "east_coast"
      ],
      "default": "unknown",
      "description": "The location of Shockley’s semiconductor laboratory."
    },
    "semiconductor.team_structure": {
      "type": "enum",
      "values": [
        "unknown",
        "shockley_intact",
        "fairchild"
      ],
      "default": "unknown",
      "description": "Whether Shockley’s team remains intact or forms Fairchild."
    },
    "semiconductor.diaspora": {
      "type": "enum",
      "values": [
        "none",
        "suppressed",
        "active"
      ],
      "default": "none",
      "description": "Whether Fairchild alumni form a multiplying network of semiconductor spinoffs."
    },
    "venture.power_law_demonstrated": {
      "type": "boolean",
      "default": false,
      "description": "A prominent team-first investment demonstrates power-law venture returns."
    },
    "venture.model": {
      "type": "enum",
      "values": [
        "none",
        "angel",
        "institutional",
        "accelerator",
        "platform"
      ],
      "default": "none",
      "description": "The most developed organizational model for startup finance."
    },
    "venture.capital_regime": {
      "type": "enum",
      "values": [
        "scarce",
        "growing",
        "abundant",
        "disciplined"
      ],
      "default": "scarce",
      "description": "The prevailing availability and discipline of venture capital."
    },
    "apple.status": {
      "type": "enum",
      "values": [
        "none",
        "independent",
        "absorbed"
      ],
      "default": "none",
      "description": "Whether Apple becomes an independent company or is absorbed early."
    },
    "network.arpanet_available": {
      "type": "boolean",
      "default": false,
      "description": "A packet-switched research network connects major universities."
    },
    "network.tcp_ip_open": {
      "type": "boolean",
      "default": false,
      "description": "Open internetworking protocols allow independent networks to interoperate."
    },
    "web.model": {
      "type": "enum",
      "values": [
        "none",
        "open",
        "proprietary"
      ],
      "default": "none",
      "description": "Whether networked information is organized through an open web or proprietary service."
    },
    "internet.capital_wave": {
      "type": "enum",
      "values": [
        "none",
        "muted",
        "boom"
      ],
      "default": "none",
      "description": "The strength of venture and public-market investment in internet-native firms."
    },
    "platform.mobile_model": {
      "type": "enum",
      "values": [
        "none",
        "closed",
        "app_store",
        "alternative_open"
      ],
      "default": "none",
      "description": "The dominant distribution model for third-party mobile software."
    },
    "founder.governance": {
      "type": "enum",
      "values": [
        "balanced",
        "founder_dominant",
        "investor_reasserted"
      ],
      "default": "balanced",
      "description": "The prevailing balance between founder control and board or investor oversight."
    },
    "geography.startup_model": {
      "type": "enum",
      "values": [
        "valley",
        "distributed",
        "global_valley_copy"
      ],
      "default": "valley",
      "description": "Whether startup formation stays concentrated, becomes distributed, or globally copies the Valley model."
    },
    "openai.structure": {
      "type": "enum",
      "values": [
        "none",
        "nonprofit",
        "capped_profit"
      ],
      "default": "none",
      "description": "The institutional structure of OpenAI, if it exists."
    },
    "ai.capital_model": {
      "type": "enum",
      "values": [
        "none",
        "startup_wave",
        "incumbent_concentration"
      ],
      "default": "none",
      "description": "Whether AI investment creates new firms or concentrates inside incumbents."
    },
    "ai.geography": {
      "type": "enum",
      "values": [
        "unknown",
        "bay_area",
        "distributed"
      ],
      "default": "unknown",
      "description": "The geographic distribution of AI-era talent and company formation."
    }
  }
}
